<?xml version="1.0" encoding="UTF-8"?>
<NameGen xmlns:xsi="http://www.w3.org/2001/XMLSchema-instance" xsi:noNamespaceSchemaLocation="namegen.xsd">
  <Description display_name="Elven Names">
    <Param id="firstname" display_name="First name" />
    <Param id="gender" display_name="Gender (0: masculine, 1: feminine)" />
    <Param id="surname" display_name="Surname" />
    Generates elven names, inspired by Celtic, Welsh, and various mythological
    sources.
  </Description>
  <Join sep=" ">
    <Switch id="gender">
      <Markov id="firstname" target_min="4" target_max="10">
        Aderiol Adeth Adiol Aerand Aerannol Aerathiand Aeriol Aeron Aerond Ailill
        Amaethon Aneirin Aodh Aonghus Arawn Arthfael Bedivere Belanor Belenos Brandior
        Brochfael Cadfael Cael Carrinnor Cernunnos Connla Conor Coriand Cynwrig Dagda
        Deimne Deinniol Dewydd Diarmaid Dylan Eannin Earand Earin Earond Eilieth Eiliol
        Einion Einiond Eirdor Ellarond Ellethiand Ellonviol Elluthiol Elluvior Eoghan
        Eonthiol Eremon Evand Evandiol Faedior Faennin Faeonel Fearghas Fionn Gareth
        Glenndower Gofannon Goronwy Gwenddoleu Gwydion Halamar Heilyn Herule Heruli
        Ianiol Ianor Iorwerth Iriol Iruthiond Iuand Iuthol Ivaran Jannalor Lamruil Llew
        Llyr Luthais Luthior Luvieth Lythinn Maelgwn Manawydan Mealcun Merfyn Mermin
        Morcant Myarand Myaron Myrddin Naoise Neirin Nuada Nunviond Nuvian Nynniaw
        Oissine Parthalan Peredur Pwyll Rheviand Rhiviond Rhondor Rhosior Segdae Seisyll
        Sharian Shariand Sharinnor Slaine Sudiond Syareth Syorond Taliesin Tanriond
        Taranis Tariond Thaliand Thardiond Tharidinn Toriand Trahern Tryariol Tutgual
        Tyorwer Uthyr Vandiol Voridower Vorior Ywain Zelphar
      </Markov>
      <Markov id="firstname" target_min="4" target_max="10">
        Aderyn Aerafrin Aerathielle Aerona Aeronvia Aeronwen Agrona Aife Ailbhe Andraste
        Angharad Anwen Aoife Ayda Blathine Blodeuedde Branwen Branwenne Bronwyn Carrian
        Ceibfionne Cithrel Cliodna Corianna Daireanne Dairine Derdriu Eadan Eadaoinne
        Eafrin Eawen Eawynne Eilwyn Eirian Eirwen Eithne Ellarwyn Ellethia Ellonvia
        Elluthia Elluvia Eonoa Eonthia Etainne Faewen Faewynne Fayelle Fayonelle
        Feyarwyn Feyelle Feyonoa Finnguala Fionnuala Gladys Glorafrin Gloriel Grainne
        Gwenda Gwendolynne Gwenna Gwennyth Gwynna Gwynnyth Iriel Iruthia Jasianna
        Lorasatra Luthiel Luvioa Lythianna Maeve Matrona Merethyl Merialeth Merrianna
        Morafrin Morgan Morriganne Morwen Morwynne Muirenne Muirne Neamhainne Neasa
        Nithenoel Nolwen Nunvioa Olwenne Paphyra Quennalynne Rheva Rhiannon Rhiva
        Rhonwynne Rhosyn Rigantona Sabia Saphielle Shyannon Shyarwen Sinanne Sionanne
        Sirona Solana Sophia Syarelle Syareth Taegen Tanila Tannaquille Tarieth Tiriana
        Tolwyn Toria Urosynne Ursalynne Ursula Urwyn Violette Voriel Vorionia Yvaine
        Yvonne Zaleria
      </Markov>
    </Switch>
    <Join>
      <Words id="surname">
        Ash Ashen Autumn Bark Birch Bird Blossom Blue Bracken Bramble Brave Breeze
        Bright Brook Bush Cloud Cold Cool Crow Dark Dawn Day Dream Drift Dusk Ember Ever
        Fair Falcon Far Feather Fenn Fern Fey Fire Flame Forest Frost Green Grey Hail
        Hawk High Hunt Leaf Light Merry Mist Moon Nettle Night Oak Oaken Ocean Owl Pale
        Pine Quick Rain Raven River Rose Sapling Seeker Shade Shadow Shore Shrub Silver
        Sky Sparrow Spell Staff Star Storm Summer Sun Swift Thorn Tree Twig Vine Wander
        Whisper Wild Willow Wind Winter Wood Wooden Wren Yew
      </Words>
      <Words>
        bark birch bird bloom blossom bow bracken bramble branch breeze briar brook bush
        caller caster cliff cloud crow dance dancer dawn dreamer drifter dusk dweller
        fair falcon feather fenn fern fey fire flame forest frost gale hail hawk heart
        hunter keen leaf light merry mist moon moss nettle night oak pine rain raven
        river rose sapling sea seed seeker seer shade shadow shore shrub silver singer
        sky song soul sparrow spell staff star stave strider summer sun sure swift thorn
        treader tree twig twiggy twigs vine walker wander wanderer whisper wild willow
        wind wing winter wise wood woods
      </Words>
    </Join>
  </Join>
</NameGen>
