<?xml version="1.0" encoding="UTF-8"?>
<NameGen xmlns:xsi="http://www.w3.org/2001/XMLSchema-instance" xsi:noNamespaceSchemaLocation="namegen.xsd">
  <Description display_name="Epick Phantasie">
    <Param id="firstname" display_name="First name" />
    <Param id="surname" display_name="Surname" />
    Produces the most epick of phantasie names taken from forbidden grimoires of
    dark and ancient magicks. These grand names are fit only for the edgiest of
    edgelordes.
  </Description>
  <Join sep=" ">
    <Switch>
      <Markov id="firstname" target_min="4" target_max="10">
        Abaddon Abraxas Acheron Achilles Ada Adeline Aeneas Aerial Agamemnon Aiden Ajax
        Alaric Alexander Alfred Alioth Amber Ambrosius Andromeda Angus Antares Anubis
        Aphrodite Apollo Aquarius Areal Ares Ariadne Artemis Arthur Asclepius Ash
        Asmodeus Asreal Astaroth Astrid Athena Atlas Atticus Auberon Augusta Augustus
        Aurelius Azrael Bacchus Baldr Baldur Bane Baphomet Bastet Beelzebub Behemoth
        Belial Belinda Bellatrix Bellerophon Belphegor Beowulf Berrant Bjarne Bjorn
        Blaphomet Blaze Bramble Brand Brandon Brimstone Cadfeal Cadmus Caius Caligula
        Calliope Calypso Cambiel Castor Cato Celestia Cerberus Cernunnos Chaos Charon
        Chastity Chiron Chronos Circe Claudius Cleopatra Colossus Condor Conor Corvus
        Craze Cronus Cupid Cygnus Cyrus Daedalus Dagon Damion Damocles Dariel Darius
        Delilah Demeter Desdemona Despina Diabolus Diana Dionysus Django Dominique
        Dorian Draco Draconis Dracula Draven Drusilla Drusus Dylan Dædalus Eden Eir
        Elizabeth Elysium Endymion Erebus Eris Eros Eternity Eurydice Evangeline Eve
        Faust Faustus Fenrir Fionn Freya Gabriel Gaia Galadriel Galahad Galatea Gale
        Ganymede Gawain Genghis Gideon Gilgamesh Gloria Goliath Gorgon Grendel Guinevere
        Hades Hannibal Hazel Hecate Hector Hel Hela Helena Helga Helios Helix Hephaestus
        Hera Heracles Hercules Hermes Hestia Hexxus Hilda Hildegarde Horus Hrothgar
        Hypatia Hyperion Hypnos Icarus Ignatius Imogen Imperia Imperius Io Isis Isolde
        Jack Janus Jareth Jasmine Jason Jericho Jester Judas Julius Juno Jupiter Kael
        Kali Kassandra Khan Kronos Lance Lancelot Lazarus Leander Leonidas Leonora
        Leviathan Lilith Loki Lorelei Lucifer Lucius Luna Lysander Macleod Magellan
        Magnus Magus Mammon Mars Matilda Maverick Maxima Maximus Medusa Melchior
        Mercedes Mercury Mercy Merlin Mesmer Minerva Mordred Morgan Morgana Morgause
        Morpheus Morphine Morrigan Mortimer Murmur Mystery Narcissus Nemesis Nephthys
        Neptune Nereus Nike Nimue Nyx Oberon Octavia Odin Odysseus Oedipus Ophelia Orion
        Orpheus Osiris Pan Pandora Paradoxia Paradoxius Paris Patroclus Pegasus
        Penndragon Persephone Perseus Phoebe Phoenix Pluto Poseidon Prometheus Prospero
        Psyche Puck Quasimodo Quintus Ragnar Raijin Raziel Rhea Rhiannon Rhiva Romulus
        Sable Sabriel Samael Samson Samuel Saphiel Sapphira Saturn Seeker Selene Seraph
        Seraphina Shiva Sigurd Sirius Skadi Sobek Solitaire Solomon Solstice Stiletto
        Tarot Temperance Thaddaeus Thalassa Thalassia Thanatos Themis Theophantos
        Theseus Thor Thoth Tiamat Titania Tobias Triton Tyr Ulysses Uranus Uriel Ursa
        Ursula Valentina Valentine Valour Venus Vercingetorix Vesper Vespera Vesta
        Vesuvius Vex Veyra Veyron Veyronia Veyronius Veyronyxia Victor Victoria Vladimir
        Vorion Vulcan Wallace Washington Watson Wolfgang Wormwood Xanthe Xavier Xena
        Xeno Xerxes Xylander Yggdrasil Ymir Ysolde Yvaine Zacharias Zachariel Zagreus
        Zephron Zephyr Zephyrine Zephyrus Zethus Zeus Zoltan Zora Zorina Zorion Zorya
        Zyra Zythia
      </Markov>
    </Switch>
    <Switch>
      <Words id="surname">
        Abjuror Abyssal Aeromancer Albion Alchemist Angel Apostate Arcana Arcane Arcanum
        Archangel Archon Artificer Assassin Augur Avatar Baleful Basilisk Berserker
        Blizzard Bloodoracle Cacodæmon Celestial Chimera Chronomancer Claymore Conjuror
        Crimson Cryomancer Crystal Cyclops Damned Destroyer Divine Diviner Draco Dracula
        Drake Dreadnought Dreamweaver Dæmon Dæmonifuge Dæmonslayer Eagle-eye Eclipse
        Eldritch Electromancer Ember Enchanter Enchantress Enigma Enigmatic Enraptured
        Enslaver Ensorcelled Enticer Entwined Eternal Evermore Exorcist Falconer
        Fireball Forsaken Færie Geomancer Gladiator Godslayer Gorgon Grimoire
        Hammersmite Harpy Hawkeye Heretic Hexblade Hydromancer Illusionist Incubus
        Infernal Jackal Jaeger Juggernaut Kraken Legend Leviathan Lightning Lycanthrope
        Magus Maledictor Mancubus Manticore Marauder Metatron Midnight Minotaur Mystic
        Necromancer Nightengale Nightmare Oblivion Omen Oracle Orcus Paladin
        Pandæmonium Paracosm Paradox Phantasie Phantasm Phantom Phobia Photon Prism
        Profane Psion Pyromancer Quake Ragnarok Rainbow Ravager Reaper Revenant
        Sabertooth Scarlet Scion Seer Seeress Seraphim Shadow Smiter Soothsayer Sorcerer
        Sorceress Spectre Squander Strider Succubus Summoner Thaumaturge Twilight
        Typhoon Undertaker Vampire Venom Venomsoul Vulture Warlock Warlord Wendigo
        Werewolf Wizard Wraith Zephyr
      </Words>
      <Join>
        <Words id="surname">
          Arch Ashen Astral Battle Beast Black Blood Blue Bone Brave Bronze Brown Crimson
          Crystal Dark Dawn Death Deep Doom Dragon Dread Dream Dusk Dæmon Earth Elden
          Ember Ever Fate Fey Fiend Fire Ghost Ghoul Giant Gloom God Gorgon Grave Great
          Grief Grim Gryphon Hammer Hate Hawk Hell Hero Hex High Iron Kill Kraken Lion
          Lizard Lych Mad Mammoth Mist Monster Mourn Night Oaken Phantom Poison Raven Rune
          Serpent Shadow Sin Skull Sorrow Soul Spell Star Steel Storm Sun Thunder Titan
          Troll Under Venom Void Wander War Wight Wild Wind Winter Witch Wolf Wraith Wyrm
          Wyvern Ælder
        </Words>
        <Words>
          axe blade blessed blood born breaker bringer caller caster chant cinder claw
          cloak cloud conjure cursed dagger dark doom dread dreamer eater eye fallen fang
          fate fire flayer folk forged frozen ghost grim guard hand heart helm hexxor holy
          hunt hunter keeper killer kin kind king knight light lord lost magick master
          meister might mind mourner murder night phantom priest python queen raven reaper
          rider rogue sabre sbane scythe seeker shadow shaker singer sinner skull sky
          slayer smite song sorrow soul speaker spectre spell spire stalker stealer stomp
          storm strider summoner sure sword talon thief thorn true walker ward weaver wing
          winter wise witch wolf wraith wrath wyrm
        </Words>
      </Join>
    </Switch>
  </Join>
</NameGen>
